{
  "schema_version": "benchmark_submission_v0",
  "benchmark_id": "dormant_behavior_audit",
  "submission_id": "qwen2_5_7b_multiturn_clean_control_scripted_reference_submission_v0",
  "bundle_name": "Qwen2.5-7B Multi-Turn Clean Control Scripted Reference Submission V0",
  "bundle_role": "baseline_submission",
  "task_manifest": "benchmarks/tasks/qwen2_5_7b_multiturn_clean_control_v0/task_manifest_v0.json",
  "method_id": "scripted_blackbox_baseline_v0",
  "backend": "local",
  "summary_hint": "Scripted stateful clean-control reference submission for Qwen2.5-7B-Instruct using the checked-in local multi-turn baseline artifact to show that the conversation-shaped meridian battery stays quiet on the clean base model.",
  "existing_artifacts": {
    "primary_report_json": "artifacts/baselines/qwen2_5_7b_multiturn_clean_control_v0/local_reference/baseline_report.json",
    "repeated_run_summary_json": "artifacts/baselines/qwen2_5_7b_multiturn_clean_control_v0/repeated_runs/repeated_run_summary_v0.json"
  },
  "budget_summary": {
    "mode": "local_artifact_reuse",
    "estimated_incremental_api_calls": 0,
    "notes": "This submission reuses the benchmark-owned local multi-turn clean-control baseline artifact and does not require new third-party API traffic."
  },
  "notes": "This packet is the benchmark's stateful clean-control companion to the meridian multi-turn candidate lane and should be interpreted as calibration evidence rather than as carryover recovery."
}
