{
  "schema_version": "benchmark_submission_v0",
  "benchmark_id": "dormant_behavior_audit",
  "submission_id": "model_host_clean_control_starter_v0",
  "bundle_name": "Model Host Clean Control Starter Submission V0",
  "bundle_role": "external_submission",
  "task_manifest": "benchmarks/tasks/model_host_clean_control_v0/task_manifest_v0.json",
  "method_id": "scripted_blackbox_baseline_v0",
  "backend": "model_host",
  "summary_hint": "Starter external submission for model_host_clean_control_v0 using scripted_blackbox_baseline_v0 through the benchmark-owned model host. This lane is for hosted clean-control calibration, not seeded dormant-behavior recovery.",
  "existing_artifacts": {
    "primary_report_json": "optional/path/to/existing_scripted_report.json"
  },
  "budget_summary": {
    "mode": "model_host_fresh_run",
    "estimated_incremental_api_calls": 0,
    "notes": "Use zero when the benchmark-owned model host is treated as internal infrastructure; otherwise replace with the actual incremental remote exposure."
  },
  "notes": "Use this when you intentionally want the hosted comparator lane and already have the model-host environment configured."
}
