{
  "schema_version": "benchmark_submission_v0",
  "benchmark_id": "dormant_behavior_audit",
  "submission_id": "example_external_warmup_hybrid_v0",
  "bundle_name": "Example External Warmup Hybrid Submission V0",
  "bundle_role": "external_submission",
  "task_manifest": "benchmarks/tasks/warmup_alibaba_seeded_v0/task_manifest_v0.json",
  "method_id": "hybrid_openweight_baseline_v0",
  "backend": "local",
  "summary_hint": "Starter external submission for warmup_alibaba_seeded_v0 using hybrid_openweight_baseline_v0 on a local backend. Replace this with a concise description of the method, whether you reused black-box or hybrid reports, and the Alibaba-family claim you expect to recover.",
  "existing_artifacts": {
    "primary_report_json": "optional/path/to/existing_hybrid_report.json",
    "blackbox_report_json": "optional/path/to/existing_blackbox_report.json"
  },
  "budget_summary": {
    "mode": "local_or_permissioned_eval",
    "estimated_incremental_api_calls": 0,
    "notes": "Replace with the local compute budget and any reused local black-box or hybrid reports."
  },
  "notes": "Recommended first positive-case local packet. This lane gives contributors a clean seeded task plus room for supporting open-weight corroboration."
}
