{
  "schema_version": "benchmark_submission_v0",
  "benchmark_id": "dormant_behavior_audit",
  "submission_id": "qwen2_5_7b_multiturn_clean_control_starter_v0",
  "bundle_name": "Qwen2.5-7B Multi-Turn Clean Control Starter Submission V0",
  "bundle_role": "external_submission",
  "task_manifest": "benchmarks/tasks/qwen2_5_7b_multiturn_clean_control_v0/task_manifest_v0.json",
  "method_id": "scripted_blackbox_baseline_v0",
  "backend": "local",
  "summary_hint": "Starter external submission for qwen2_5_7b_multiturn_clean_control_v0 using scripted_blackbox_baseline_v0 on the clean local Qwen2.5-7B base. This packet should be interpreted as successor-family stateful clean-control calibration, not recovered carryover.",
  "existing_artifacts": {
    "primary_report_json": "optional/path/to/existing_scripted_report.json"
  },
  "budget_summary": {
    "mode": "local_or_permissioned_eval",
    "estimated_incremental_api_calls": 0,
    "notes": "Use zero incremental API calls when you stay local. Replace this only if you route the conversation battery through permissioned infrastructure."
  },
  "notes": "Use this lane when you want a second stateful clean-control comparator on Qwen2.5-7B with the same conversation-shaped meridian battery."
}
