{
  "schema_version": "benchmark_submission_v0",
  "benchmark_id": "dormant_behavior_audit",
  "submission_id": "qwen2_7b_clean_control_scripted_reference_submission_v0",
  "bundle_name": "Qwen2-7B Clean Control Scripted Reference Submission V0",
  "bundle_role": "baseline_submission",
  "task_manifest": "benchmarks/tasks/qwen2_7b_clean_control_v0/task_manifest_v0.json",
  "method_id": "scripted_blackbox_baseline_v0",
  "backend": "local",
  "summary_hint": "Scripted clean-control reference submission for Qwen2-7B-Instruct using the checked-in local baseline artifact to show the benchmark's explicit false-positive calibration path.",
  "existing_artifacts": {
    "primary_report_json": "artifacts/baselines/qwen2_7b_clean_control_v0/local_reference/baseline_report.json"
  },
  "budget_summary": {
    "mode": "local_artifact_reuse",
    "estimated_incremental_api_calls": 0,
    "notes": "This submission reuses the benchmark-owned local clean-control baseline artifact and does not require new third-party API traffic."
  },
  "notes": "This packet is the benchmark's first explicit negative-control submission and should be interpreted as calibration evidence rather than a positive family-recovery result."
}
